{
  "loom_format_version": 1,
  "id": "E1M",
  "version": "1.0",
  "footprint_class": "FC_35x35",
  "outline_mm": {
    "w": 35,
    "h": 35
  },
  "pads": [
    {
      "id": "A1",
      "silkscreen": "GND",
      "default": "GND",
      "alt": []
    },
    {
      "id": "A2",
      "silkscreen": "USB_CC1",
      "default": "USB_CC1",
      "alt": [
        {
          "signal": "GPIO"
        }
      ]
    },
    {
      "id": "A3",
      "silkscreen": "PWM6",
      "default": "PWM",
      "instance": "PWM6",
      "alt": [
        {
          "signal": "GPIO"
        }
      ]
    },
    {
      "id": "A4",
      "silkscreen": "PWM4",
      "default": "PWM",
      "instance": "PWM4",
      "alt": [
        {
          "signal": "GPIO"
        }
      ]
    },
    {
      "id": "A5",
      "silkscreen": "PWM2",
      "default": "PWM",
      "instance": "PWM2",
      "alt": [
        {
          "signal": "GPIO"
        }
      ]
    },
    {
      "id": "A6",
      "silkscreen": "PWM0",
      "default": "PWM",
      "instance": "PWM0",
      "alt": [
        {
          "signal": "GPIO"
        }
      ]
    },
    {
      "id": "A7",
      "silkscreen": "ENC3_X",
      "default": "ENC_X",
      "instance": "ENC3",
      "alt": [
        {
          "signal": "GPIO"
        }
      ]
    },
    {
      "id": "A8",
      "silkscreen": "ENC2_X",
      "default": "ENC_X",
      "instance": "ENC2",
      "alt": [
        {
          "signal": "GPIO"
        }
      ]
    },
    {
      "id": "A9",
      "silkscreen": "ENC1_X",
      "default": "ENC_X",
      "instance": "ENC1",
      "alt": [
        {
          "signal": "GPIO"
        }
      ]
    },
    {
      "id": "A10",
      "silkscreen": "ENC0_X",
      "default": "ENC_X",
      "instance": "ENC0",
      "alt": [
        {
          "signal": "GPIO"
        }
      ]
    },
    {
      "id": "A11",
      "silkscreen": "GND",
      "default": "GND",
      "alt": []
    },
    {
      "id": "A12",
      "silkscreen": "ANA_S6",
      "default": "ADC",
      "instance": "ADC6",
      "alt": [
        {
          "signal": "GPIO"
        }
      ]
    },
    {
      "id": "A13",
      "silkscreen": "ANA_S4",
      "default": "ADC",
      "instance": "ADC4",
      "alt": [
        {
          "signal": "GPIO"
        }
      ]
    },
    {
      "id": "A14",
      "silkscreen": "ANA_S2",
      "default": "ADC",
      "instance": "ADC2",
      "alt": [
        {
          "signal": "GPIO"
        }
      ]
    },
    {
      "id": "A15",
      "silkscreen": "ANA_S0",
      "default": "ADC",
      "instance": "ADC0",
      "alt": [
        {
          "signal": "GPIO"
        }
      ]
    },
    {
      "id": "A16",
      "silkscreen": "DAC0",
      "default": "DAC",
      "instance": "DAC0",
      "alt": [
        {
          "signal": "GPIO"
        }
      ]
    },
    {
      "id": "A17",
      "silkscreen": "GND",
      "default": "GND",
      "alt": []
    },
    {
      "id": "A18",
      "silkscreen": "IO11",
      "default": "GPIO",
      "alt": []
    },
    {
      "id": "A19",
      "silkscreen": "CAN_STBY",
      "default": "CAN_STBY",
      "alt": [
        {
          "signal": "GPIO"
        }
      ]
    },
    {
      "id": "A20",
      "silkscreen": "GND",
      "default": "GND",
      "alt": []
    },
    {
      "id": "A21",
      "silkscreen": "PCIE0_TX0_P",
      "default": "PCIE_TX0_P",
      "instance": "PCIE0",
      "alt": [
        {
          "signal": "GPIO"
        }
      ]
    },
    {
      "id": "A22",
      "silkscreen": "PCIE0_TX1_P",
      "default": "PCIE_TX1_P",
      "instance": "PCIE0",
      "alt": [
        {
          "signal": "GPIO"
        }
      ]
    },
    {
      "id": "A23",
      "silkscreen": "PCIE0_TX2_P",
      "default": "PCIE_TX2_P",
      "instance": "PCIE0",
      "alt": [
        {
          "signal": "GPIO"
        }
      ]
    },
    {
      "id": "A24",
      "silkscreen": "PCIE0_TX3_P",
      "default": "PCIE_TX3_P",
      "instance": "PCIE0",
      "alt": [
        {
          "signal": "GPIO"
        }
      ]
    },
    {
      "id": "A25",
      "silkscreen": "PCIE0_RX0_P",
      "default": "PCIE_RX0_P",
      "instance": "PCIE0",
      "alt": [
        {
          "signal": "GPIO"
        }
      ]
    },
    {
      "id": "A26",
      "silkscreen": "PCIE0_RX1_P",
      "default": "PCIE_RX1_P",
      "instance": "PCIE0",
      "alt": [
        {
          "signal": "GPIO"
        }
      ]
    },
    {
      "id": "A27",
      "silkscreen": "PCIE0_RX2_P",
      "default": "PCIE_RX2_P",
      "instance": "PCIE0",
      "alt": [
        {
          "signal": "GPIO"
        }
      ]
    },
    {
      "id": "A28",
      "silkscreen": "PCIE0_RX3_P",
      "default": "PCIE_RX3_P",
      "instance": "PCIE0",
      "alt": [
        {
          "signal": "GPIO"
        }
      ]
    },
    {
      "id": "A29",
      "silkscreen": "PCIE0_CLK_P",
      "default": "PCIE_CLK_P",
      "instance": "PCIE0",
      "alt": [
        {
          "signal": "GPIO"
        }
      ]
    },
    {
      "id": "A30",
      "silkscreen": "GND",
      "default": "GND",
      "alt": []
    },
    {
      "id": "A31",
      "silkscreen": "BL_LED_A",
      "default": "BL_LED_A",
      "alt": []
    },
    {
      "id": "A32",
      "silkscreen": "GND",
      "default": "GND",
      "alt": []
    },
    {
      "id": "A33",
      "silkscreen": "RSVD",
      "default": "RSVD",
      "alt": []
    },
    {
      "id": "A34",
      "silkscreen": "RSVD",
      "default": "RSVD",
      "alt": []
    },
    {
      "id": "B1",
      "silkscreen": "USB0_30_D_P",
      "default": "USB_DP",
      "instance": "USB0",
      "alt": [
        {
          "signal": "GPIO"
        }
      ]
    },
    {
      "id": "B2",
      "silkscreen": "USB_CC2",
      "default": "USB_CC2",
      "alt": [
        {
          "signal": "GPIO"
        }
      ]
    },
    {
      "id": "B3",
      "silkscreen": "PWM7",
      "default": "PWM",
      "instance": "PWM7",
      "alt": [
        {
          "signal": "GPIO"
        }
      ]
    },
    {
      "id": "B4",
      "silkscreen": "PWM5",
      "default": "PWM",
      "instance": "PWM5",
      "alt": [
        {
          "signal": "GPIO"
        }
      ]
    },
    {
      "id": "B5",
      "silkscreen": "PWM3",
      "default": "PWM",
      "instance": "PWM3",
      "alt": [
        {
          "signal": "GPIO"
        }
      ]
    },
    {
      "id": "B6",
      "silkscreen": "PWM1",
      "default": "PWM",
      "instance": "PWM1",
      "alt": [
        {
          "signal": "GPIO"
        }
      ]
    },
    {
      "id": "B7",
      "silkscreen": "ENC3_Y",
      "default": "ENC_Y",
      "instance": "ENC3",
      "alt": [
        {
          "signal": "GPIO"
        }
      ]
    },
    {
      "id": "B8",
      "silkscreen": "ENC2_Y",
      "default": "ENC_Y",
      "instance": "ENC2",
      "alt": [
        {
          "signal": "GPIO"
        }
      ]
    },
    {
      "id": "B9",
      "silkscreen": "ENC1_Y",
      "default": "ENC_Y",
      "instance": "ENC1",
      "alt": [
        {
          "signal": "GPIO"
        }
      ]
    },
    {
      "id": "B10",
      "silkscreen": "ENC0_Y",
      "default": "ENC_Y",
      "instance": "ENC0",
      "alt": [
        {
          "signal": "GPIO"
        }
      ]
    },
    {
      "id": "B11",
      "silkscreen": "GND",
      "default": "GND",
      "alt": []
    },
    {
      "id": "B12",
      "silkscreen": "ANA_S7",
      "default": "ADC",
      "instance": "ADC7",
      "alt": [
        {
          "signal": "GPIO"
        }
      ]
    },
    {
      "id": "B13",
      "silkscreen": "ANA_S5",
      "default": "ADC",
      "instance": "ADC5",
      "alt": [
        {
          "signal": "GPIO"
        }
      ]
    },
    {
      "id": "B14",
      "silkscreen": "ANA_S3",
      "default": "ADC",
      "instance": "ADC3",
      "alt": [
        {
          "signal": "GPIO"
        }
      ]
    },
    {
      "id": "B15",
      "silkscreen": "ANA_S1",
      "default": "ADC",
      "instance": "ADC1",
      "alt": [
        {
          "signal": "GPIO"
        }
      ]
    },
    {
      "id": "B16",
      "silkscreen": "DAC1",
      "default": "DAC",
      "instance": "DAC1",
      "alt": [
        {
          "signal": "GPIO"
        }
      ]
    },
    {
      "id": "B17",
      "silkscreen": "GND",
      "default": "GND",
      "alt": []
    },
    {
      "id": "B18",
      "silkscreen": "CAN0H/CAN0_TX",
      "default": "CAN_H",
      "instance": "CAN0",
      "alt": [
        {
          "signal": "CAN_TX",
          "instance": "CAN0"
        },
        {
          "signal": "GPIO"
        }
      ]
    },
    {
      "id": "B19",
      "silkscreen": "CAN0L/CAN0_RX",
      "default": "CAN_L",
      "instance": "CAN0",
      "alt": [
        {
          "signal": "CAN_RX",
          "instance": "CAN0"
        },
        {
          "signal": "GPIO"
        }
      ]
    },
    {
      "id": "B20",
      "silkscreen": "GND",
      "default": "GND",
      "alt": []
    },
    {
      "id": "B21",
      "silkscreen": "PCIE0_TX0_N",
      "default": "PCIE_TX0_N",
      "instance": "PCIE0",
      "alt": [
        {
          "signal": "GPIO"
        }
      ]
    },
    {
      "id": "B22",
      "silkscreen": "PCIE0_TX1_N",
      "default": "PCIE_TX1_N",
      "instance": "PCIE0",
      "alt": [
        {
          "signal": "GPIO"
        }
      ]
    },
    {
      "id": "B23",
      "silkscreen": "PCIE0_TX2_N",
      "default": "PCIE_TX2_N",
      "instance": "PCIE0",
      "alt": [
        {
          "signal": "GPIO"
        }
      ]
    },
    {
      "id": "B24",
      "silkscreen": "PCIE0_TX3_N",
      "default": "PCIE_TX3_N",
      "instance": "PCIE0",
      "alt": [
        {
          "signal": "GPIO"
        }
      ]
    },
    {
      "id": "B25",
      "silkscreen": "PCIE0_RX0_N",